<?xml version="1.0" encoding="US-ASCII" ?>

<!ELEMENT   Encoding (#PCDATA)>
<!ATTLIST   Encoding
            name     CDATA #REQUIRED>

<!ELEMENT   Charset  (Encoding+)>
